{
  "$schema": "../review-record.schema.json",
  "schemaVersion": 1,
  "reviewOperator": "Codex publication gate",
  "reviewMode": "automated-with-owner-authorization",
  "reviewedAt": "2026-09-04",
  "decision": "approved",
  "id": "review:2026-09-04-preventivo-trasporto-pdf",
  "type": "editorial",
  "contentId": "guide/preventivo-trasporto-pdf",
  "contentFingerprint": "sha256:4d2bd9130cd6ad0c78931e9f0db7f0795786d5d9beb4d4554a0dc7cd8b3dba08",
  "artifactFingerprint": "sha256:abee92efed3293b7bc7af17f4bc7028aa23f0e57baeec66036e062ba3f2dd7f8",
  "ownerAuthorization": {
    "approvedBy": "Eng. Mostafa",
    "approvedAt": "2026-09-04",
    "basis": "Explicit owner request in the active task to research and write three or four distinct professional Italian articles, follow the publication gate, publish the site, and submit sitemap and indexing requests to Google and Bing."
  },
  "automatedChecks": {
    "sourceCoverage": true,
    "productClaims": true,
    "italianIntent": true,
    "seoContracts": true,
    "accessibilityContracts": true
  },
  "notes": "Automated review of contextual internal-link addition; original product boundaries, source dates and publication dates remain intact. No independent human review is claimed."
}
