{
  "$schema": "../review-record.schema.json",
  "schemaVersion": 1,
  "reviewOperator": "Codex publication gate",
  "reviewMode": "automated-with-owner-authorization",
  "reviewedAt": "2026-09-06",
  "decision": "approved",
  "id": "review:2026-09-06-divieti-circolazione-mezzi-pesanti-2026",
  "type": "editorial",
  "contentId": "guide/divieti-circolazione-mezzi-pesanti-2026",
  "contentFingerprint": "sha256:4974c139ad077dc64546ef7f242be26332cfe150d9376d88bb08810bfde41e87",
  "artifactFingerprint": "sha256:0d8907d21a72e3115fbd8aea88344554ba76750a67017ebd39b9d477e06e060c",
  "ownerAuthorization": {
    "approvedBy": "Eng. Mostafa",
    "approvedAt": "2026-09-06",
    "basis": "Explicit active owner request to research and publish three distinct useful Italian RouteBudget articles, validate the website and submit sitemap/indexing requests to Google and Bing, with truthful ChatGPT search discovery support. This covers the contextual incoming links and exact reviewed publication artifacts; no independent human review or guaranteed ranking is claimed."
  },
  "automatedChecks": {
    "sourceCoverage": true,
    "productClaims": true,
    "italianIntent": true,
    "seoContracts": true,
    "accessibilityContracts": true
  },
  "notes": "Original Italian operational worksheet reviewed against dated primary sources and pinned product limits. Eleven integer-cent/rational arithmetic assertions passed across this batch. New bodies and mobile tables inspected; layouts sampled at 320, 375, 768 and desktop 1280 CSS pixels, without document overflow or browser errors. Not a physical iPhone test. Two keywords have exact Italian Suggest evidence; delivery cost remains an explicitly documented qualitative SERP experiment, not measured volume. No independent human, legal or driver review is claimed."
}
