{
  "$schema": "../review-record.schema.json",
  "schemaVersion": 1,
  "id": "review:2026-08-30-release-integrity",
  "type": "release-integrity",
  "reviewOperator": "Codex publication gate",
  "reviewMode": "automated-with-owner-authorization",
  "reviewedAt": "2026-08-30",
  "decision": "approved",
  "dependencyFingerprint": "sha256:c74e6400c6e4b9d457cdeb9af57a22255f6b70230521c773dd66162b3057656c",
  "dependencyFiles": {
    "content/site.json": "sha256:febf29729dabd07c96b02c823558fca0ba025a145ec14d991ca107b79489aa2c",
    "content/sources.json": "sha256:84a16b100aff448255224cf82a64199febc8662976b7d9bcae0fed7301bc8dd2",
    "package-lock.json": "sha256:239ba379b02324b5087969ecc219d7c3951be19c9b566b7b1d56926af6620f10",
    "package.json": "sha256:d4715987c9ef0a74f6da0d383204d72658e3a7d0cc968aefde2a6d6eebe2bb48",
    "public/seo/calculators-core.js": "sha256:7cd6ea73cde2129bf65cf4451ab9cf1706abcc2e4b3dbd363d5a1c4824eac846",
    "public/seo/calculators.js": "sha256:ff8a882ef4a691475208c69b072e743fc01d7baba9e47fad9b1c04a3573572d5",
    "public/seo/events.js": "sha256:a31a2a86c7120087cc2c5cb3cee5c0ec400239062d1b0dae1ff29fa751f30038",
    "public/seo/seo.css": "sha256:17fe35fe5f6721cb23b95e56c2fbb85feed3a4de6cb1dab3a2675533597f66c7",
    "scripts/build-content.mjs": "sha256:2a3295bd654a2f485a7d426f63e880923358c851f7828c5c1af284cf7b7c7871",
    "scripts/product-claim-rules.mjs": "sha256:8044cdcdbaf779c8acc61e1c75accd207bd5777826ff07145c15349da2eb32a5"
  },
  "staticArtifacts": {
    "/": "sha256:fd0d72596ae12eedc1dc3eaa964dc7decf07b2887895a9cbcfb46f339ae89315",
    "/it/calcolatori/": "sha256:0c8741dd4501cf52a894d33d1a204f300a49285d06b37855a17a7936c5a7606f",
    "/it/guide/": "sha256:58f34ac1cf1bb4f9ea721005214038bd583b15ef1f85a4c1f35f3c0597253ecc",
    "/privacy.html": "sha256:50dda2b923646bdacc538e32628a70b63ae7206b07e7862be1d8c6bb9fe4908e",
    "/terms.html": "sha256:e361a12fce34488d27fa8dce374ec0bbc6639016e2a9a59cb1628d74f55c68f5"
  },
  "transitiveArtifacts": {
    "guide/calcolare-carburante-pedaggi-autista": "sha256:b9ed396ccd0eda3439b6b7d0e5a2b631092fe51dc4e128f741a2457e413223d3",
    "guide/tachigrafo-furgoni-2026": "sha256:beb259a132b73838ffecc9091042f2682279dcc87a5f617eae59c42712ae3206"
  },
  "ownerAuthorization": {
    "approvedBy": "Eng. Mostafa",
    "approvedAt": "2026-08-30",
    "basis": "Explicit owner request in the active Codex task to diagnose RouteBudget's visibility loss and create three rare, professional Italian articles from the supplied consented field-research log."
  },
  "automatedChecks": {
    "indexableInventory": true,
    "generatedArtifacts": true,
    "dependencyClosure": true
  },
  "notes": "Pins the 60-page Italian inventory after three distinct operational guides, current source registry, research graph artifacts and rebuilt guide hub. No independent human review, volume claim or ranking guarantee is asserted."
}
