{
  "$schema": "../review-record.schema.json",
  "schemaVersion": 1,
  "reviewOperator": "Codex publication gate",
  "reviewMode": "automated-with-owner-authorization",
  "reviewedAt": "2026-09-07",
  "decision": "approved",
  "id": "review:2026-09-07-bofu-chilometrico",
  "type": "editorial",
  "contentId": "calcolatori/costo-chilometrico-camion",
  "contentFingerprint": "sha256:9eb332fd8728db44d1bd6b277bf26a7068a12ed69b46b1d87e3c0590ec525ab2",
  "artifactFingerprint": "sha256:207db01e176877b7c135250ce60984e91cd904ab0bd0adb35d54b6e7e19bec98",
  "ownerAuthorization": {
    "approvedBy": "Eng. Mostafa",
    "approvedAt": "2026-09-07",
    "basis": "Explicit owner authorization on 7 September 2026 to improve existing RouteBudget website pages for carrier purchase intent, preserve useful answers and URLs, validate the publication gate, publish through PR/gh-pages and request relevant discovery. Website only; no independent human review, native app change or ranking guarantee."
  },
  "automatedChecks": {
    "sourceCoverage": true,
    "productClaims": true,
    "italianIntent": true,
    "seoContracts": true,
    "accessibilityContracts": true
  },
  "notes": "Aggiunto controllo numerico di un’offerta sui soli km carichi, con margine sul ricavo, limiti e passaggio al PDF; nessuna tariffa di mercato dichiarata. Incremental changes inspected against pinned product source and public Italian App Store description; unrelated historical legal/tariff claims are not recertified as current. Synthetic PDF and offer arithmetic independently checked in integer cents. All 72 content pages passed four Chromium widths (320/375/768/1440); six changed surfaces inspected in mobile/desktop screenshots. Not a physical-device, legal, or independent human certification."
}
