{
  "$schema": "../review-record.schema.json",
  "schemaVersion": 1,
  "id": "review:2026-08-31-release-integrity",
  "type": "release-integrity",
  "reviewOperator": "Codex publication gate",
  "reviewMode": "automated-with-owner-authorization",
  "reviewedAt": "2026-08-31",
  "decision": "approved",
  "dependencyFingerprint": "sha256:7a58d05cdc9c7c2331c0a1708943d8b5f7a5133350ac4e1bb8b937bd9f969bd1",
  "dependencyFiles": {
    "content/site.json": "sha256:febf29729dabd07c96b02c823558fca0ba025a145ec14d991ca107b79489aa2c",
    "content/sources.json": "sha256:84a16b100aff448255224cf82a64199febc8662976b7d9bcae0fed7301bc8dd2",
    "package-lock.json": "sha256:239ba379b02324b5087969ecc219d7c3951be19c9b566b7b1d56926af6620f10",
    "package.json": "sha256:d4715987c9ef0a74f6da0d383204d72658e3a7d0cc968aefde2a6d6eebe2bb48",
    "public/seo/calculators-core.js": "sha256:7cd6ea73cde2129bf65cf4451ab9cf1706abcc2e4b3dbd363d5a1c4824eac846",
    "public/seo/calculators.js": "sha256:ff8a882ef4a691475208c69b072e743fc01d7baba9e47fad9b1c04a3573572d5",
    "public/seo/events.js": "sha256:a31a2a86c7120087cc2c5cb3cee5c0ec400239062d1b0dae1ff29fa751f30038",
    "public/seo/seo.css": "sha256:e8c7de029d1d190aace44a581f17672afc14254003fe0e07e98aafa1c292cd73",
    "scripts/build-content.mjs": "sha256:07770c1f028920f2a1add85f5b36f3d4696ccfac848a59b552f29e1f9e2f9246",
    "scripts/product-claim-rules.mjs": "sha256:8044cdcdbaf779c8acc61e1c75accd207bd5777826ff07145c15349da2eb32a5"
  },
  "staticArtifacts": {
    "/": "sha256:fd0d72596ae12eedc1dc3eaa964dc7decf07b2887895a9cbcfb46f339ae89315",
    "/it/calcolatori/": "sha256:9512b7135db1821934acd3f6a1109a484c85178ee4711e7efbee25d7a4e6186d",
    "/it/guide/": "sha256:1277aa19482a1296ab7315d9b10c096800ad561858a01808b07f896a2872b90d",
    "/privacy.html": "sha256:50dda2b923646bdacc538e32628a70b63ae7206b07e7862be1d8c6bb9fe4908e",
    "/terms.html": "sha256:e361a12fce34488d27fa8dce374ec0bbc6639016e2a9a59cb1628d74f55c68f5"
  },
  "transitiveArtifacts": {
    "guide/bgtoll-camion-bulgaria-2026": "sha256:05b10142e77e2acf018b6509e58be3d23a5633708d31502eed678a4684c808db",
    "guide/calcolare-carburante-pedaggi-autista": "sha256:a12dc8af2212a88d2cba76853fe0fc569f8530c521fff5b3d3c94900d296a313",
    "guide/calcolo-costi-trasporto-camion-excel": "sha256:23a5fe16d38af58fc640a3d2220edba35cf90c9deda48c6e4ffb35e54d7defef",
    "guide/calcolo-pedaggio-camion": "sha256:56138ca9ba859a2730ed45e9142270dee61ca099e4ad687f09fcc40d2705d49a",
    "guide/clausola-adeguamento-carburante-autotrasporto": "sha256:db747e4fa7d24b9b6f27b153caa9e646b0d2f7d46757f0fc8deeeb62020a2706",
    "guide/conviene-comprare-furgone-elettrico": "sha256:4c05ac3210930659a7e97509316e6de99a9eab2d5b5c82f2f56368178838a12d",
    "guide/costi-autotrasporto": "sha256:04a17c618b590b1dd4b43ed30bb78e0f984eb66b05c0d79cd57b9eca30af29ba",
    "guide/costi-fissi-variabili-autotrasporto": "sha256:47407d4e489c01226c39792fbed0382ec2824f38ffbef8fc1d7d966d2409be41",
    "guide/costo-autostrada-furgone": "sha256:01c027bb7e5d046d4dfac35c5f0063282e682c20d8981168c519433088ce1083",
    "guide/costo-chilometrico-camion": "sha256:bc2464f2a186291d9c90ffdb64d7513e9a9f3709408139a1e63c312d9684fd7f",
    "guide/costo-fermo-camion": "sha256:7a726a50ef55f404841c81bd0ae8ef3ac664cc6bdede07248e54dd3d26453902",
    "guide/costo-furgone-per-km": "sha256:33e91cdc654443bd1a0db423b7ec72998d9c1c20e221fa19398f50b33a5a71f6",
    "guide/costo-orario-autista-camion": "sha256:5b24f8567e556ece887646b06467cf9c19d4bb3fc3f18f639dfc51cf778b588d",
    "guide/costo-pneumatici-camion": "sha256:cc223f9f6002a133b97408a1b533b1f92160c41cd9867fb9073f4edbd87d30c0",
    "guide/costo-traghetto-camion-calais-dover-2026": "sha256:0515beff86ecf2f0180301b46fd4f7935d528739a16956f8450b7ff4f70a047f",
    "guide/costo-traghetto-camion-sardegna": "sha256:c2348f4f1202ab77cfab56005e04c8e26e29446f279a5b337ed8d8642c788264",
    "guide/costo-traghetto-camion-sicilia": "sha256:856320aa10a84de2299c36770bc05bc01b98705ad3b2f6bdba66eb5268feeb01",
    "guide/errori-calcolo-tariffa-trasporto": "sha256:a6a954084935e529388b9f3a5dea76845b7f10f691b936aee16f464a75546c66",
    "guide/eurovignette-camion-2026": "sha256:903cf489c09a1b54124ca5727f6a257e7c94943a4b3382445e0bb7dcd37b5127",
    "guide/guadagno-padroncino-camion": "sha256:680d242a6b2f8ee314c63a545a6fe950a7cb81f08bb436009fdc0c050405f8da",
    "guide/idoneita-finanziaria-autotrasporto": "sha256:f47382342ab7ae693bfc01ee2c18cd64ee64c734abb0b5e85ced8d588c630746",
    "guide/pedaggio-a22-camion-2026": "sha256:f26c54db9ca0ba5e15a864a286d4790c8470abeb1e6254349f53be63d9c81f9c",
    "guide/pedaggio-camion-austria": "sha256:025a1de1edd53d610fa51e2f8195e11df40c25808e2a0e41ffa1161c39a1d1ed",
    "guide/pedaggio-camion-belgio": "sha256:5ce753bb41cbb40310986e95556aaa64a66c0f8fa56982faba8d1cf78ef4ea89",
    "guide/pedaggio-camion-danimarca-2026": "sha256:6853bfd3f6f8a8f751c1fec3051462cbc3d62e5ff67fe9c58ed0d732c471689e",
    "guide/pedaggio-camion-francia": "sha256:1261ee7f26eca52b864fd0af461da46def594846e72fde2fdf94f04b224989cc",
    "guide/pedaggio-camion-germania": "sha256:bc5b485ef8a19a169023d8937dede49fb71ae49d620696d209031cc327eeab4b",
    "guide/pedaggio-camion-paesi-bassi": "sha256:fddcca22456249ab0e3a7a4be47c231c9f02c72bf645920c37e2c9e94153e703",
    "guide/pedaggio-camion-polonia-2026": "sha256:263f8647311f1d56e201a5a6f90a8c2a756a176228c1ac86a8ab1d123e3f4617",
    "guide/pedaggio-camion-repubblica-ceca": "sha256:98d313ea5b14c29f114e42ea8120b0b27770a601a406e76fe9345ffa404f2994",
    "guide/pedaggio-camion-serbia-2026": "sha256:cc6fb31f56dd8ca369277a6a3135a9cd51d1d8e6cef42b7e7ec8a24b4d271e2e",
    "guide/pedaggio-camion-slovenia": "sha256:f93547833a44e074105aff6d43286827066ef90857b91d34efed6a8cf0754db7",
    "guide/pedaggio-camion-svizzera": "sha256:b03b4adae36172cf8c294e1ecea9f954aa31378ab25b3e280c58110068d0787b",
    "guide/pedaggio-camion-ungheria-2026": "sha256:87767d132f6fc5e4135e684bd3699ad89d93beb086adbb837262231ca5eba923",
    "guide/preventivo-consuntivo-viaggio-camion": "sha256:cfb57fb2e8b7f6dd170f54f2872e80f71b6a46d5b3fb9f12b7c5e09012041f2a",
    "guide/preventivo-trasporto": "sha256:7db4f46c74b780d2a6dd9365fff6b9490f3efc8501117a43c409ef5d203fed30",
    "guide/preventivo-trasporto-pdf": "sha256:0be7b7954871265deae7e7362a9437b0da33d5ac3c51f3ccdf4c9f85c9cfc803",
    "guide/prezzo-gasolio-autotrasporto-preventivo": "sha256:6c22ca8bae0a0a90143ea0f0c3044bbb1be2030ceba07c12743f94e8bb542c75",
    "guide/quanto-consuma-un-furgone": "sha256:dfc2c7a4cc99d4ea782ba8125ba6f09d5b71d71aa55e1240000f6fb985b8273e",
    "guide/quanto-costa-aprire-ditta-trasporti": "sha256:a8676ea7d384616558c4a3c2d2cf153e47f7e33fdba843f1f68b43455cb1d72e",
    "guide/ritorno-a-vuoto-autotrasporto": "sha256:de7f5b21da01660def45d92625eb22f3dd947d5e124d9a9b05db9e529d63a7cd",
    "guide/tabelle-costi-autotrasporto-mit-2026": "sha256:fb6d69a8296e1bbc9c06ad3c4f740c0840229a608544124c79f45c44c6304f39",
    "guide/tachigrafo-furgoni-2026": "sha256:b6d2b976da3134f20f2349743c569ff9ae848750da30238bda3f6a6864398548",
    "guide/tariffe-trazionisti": "sha256:60f63e4875ac0f87c17677f69cd452c85cdaa01c3c04cbd762f755207e127d62",
    "guide/tempi-attesa-carico-scarico-autotrasporto": "sha256:330c11ed02166d52544c1dd5d6b16c6d424e820498c3fea67da275ff963fc6d6",
    "guide/tempi-guida-riposo-camion": "sha256:52b19a0c45c8945ec1821566eff84ef64fd6297704030ffd06b487f222b70d58",
    "guide/tempi-pagamento-autotrasporto": "sha256:4d229573b1f357ae7bca3073072051551843b611604a1f126dcf1bda5bc3c3c4",
    "guide/traghetto-camion-italia-grecia": "sha256:048b31836cbea05416140bdeeee1e7dfe47aa23735eadd4217a0990d4d3ca88c",
    "guide/trasporto-spot-significato": "sha256:daff9e85cb5ba0ecfdd710c357b1271fd5e7f6d992b6ffd436dbbd0ad7f32c36",
    "guide/usura-manutenzione-camion": "sha256:53970c2e093c8f39867099890418b7156c118cfefa4af8abe9f4fa2ad326e013",
    "calcolatori/fuel-surcharge-autotrasporto": "sha256:06d87ad6df45b059f9d95ca375c1b30f80e5366bdc54e9f65bcbbd7e2fbfd4db",
    "calcolatori/prezzo-minimo-margine-tratta": "sha256:c890c22e3ea32442896ac1e1dfa4a7a1db753d476b66d2f3a42c01b8d729a897",
    "calcolatori/quanto-costa-ricaricare-furgone-elettrico": "sha256:d67cb306587f26927931037b2487a2884eea7c4e063451e6b5ddf826210f7bcc",
    "calcolatori/tempi-guida-camion": "sha256:edf5880834dd3ce0d60176c8f5bdf9249668e26142860c38ef0d86c80e7238a8",
    "landing/app-per-autotrasportatori": "sha256:979504427ba509ca366ae633aabbf7c8611bd26a21eeecb944cb614295d9d684"
  },
  "ownerAuthorization": {
    "approvedBy": "Eng. Mostafa",
    "approvedAt": "2026-08-31",
    "basis": "Explicit owner request in the active Codex task to run a professional whole-site RouteBudget recovery campaign, resolve site structure and sitemap concerns, and improve every generated page."
  },
  "automatedChecks": {
    "indexableInventory": true,
    "generatedArtifacts": true,
    "dependencyClosure": true
  },
  "notes": "Approves shared renderer and stylesheet changes across the existing 60-page Italian inventory, two hubs and five static routes. It does not claim independent human review, ranking recovery or traffic guarantees."
}
