{
  "$schema": "../review-record.schema.json",
  "schemaVersion": 1,
  "reviewOperator": "Codex publication gate",
  "reviewMode": "automated-with-owner-authorization",
  "reviewedAt": "2026-09-07",
  "decision": "approved",
  "id": "review:2026-09-07-bofu-app",
  "type": "editorial",
  "contentId": "landing/app-per-autotrasportatori",
  "contentFingerprint": "sha256:1ca131e038d540fb24521774195ef0f32a178d78e1e2cbd4599b7ca772537a0c",
  "artifactFingerprint": "sha256:7e9df9c6c6e568a3225266c9a440ea3e293c088beecd931b816d9c18be7f0ad2",
  "ownerAuthorization": {
    "approvedBy": "Eng. Mostafa",
    "approvedAt": "2026-09-07",
    "basis": "Explicit owner authorization on 7 September 2026 to improve existing RouteBudget website pages for carrier purchase intent, preserve useful answers and URLs, validate the publication gate, publish through PR/gh-pages and request relevant discovery. Website only; no independent human review, native app change or ranking guarantee."
  },
  "automatedChecks": {
    "sourceCoverage": true,
    "productClaims": true,
    "italianIntent": true,
    "seoContracts": true,
    "accessibilityContracts": true
  },
  "notes": "Chiarita la scelta dell’app dal punto di vista del trasportatore: percorso verso esempio PDF verificabile, schermate e controllo del costo; nessuna promessa di ricerca carichi o gestione flotta. Incremental changes inspected against pinned product source and public Italian App Store description; unrelated historical legal/tariff claims are not recertified as current. Synthetic PDF and offer arithmetic independently checked in integer cents. All 72 content pages passed four Chromium widths (320/375/768/1440); six changed surfaces inspected in mobile/desktop screenshots. Not a physical-device, legal, or independent human certification."
}
