{
  "$schema": "../review-record.schema.json",
  "schemaVersion": 1,
  "id": "review:2026-08-29-tempi-pagamento",
  "type": "editorial",
  "reviewOperator": "Codex publication gate",
  "reviewMode": "automated-with-owner-authorization",
  "reviewedAt": "2026-08-29",
  "decision": "approved",
  "contentId": "guide/tempi-pagamento-autotrasporto",
  "contentFingerprint": "sha256:a446a0e9abe5b143f383a438e4d4f96c001abe545f5c52d00b1d832ab25c7d44",
  "artifactFingerprint": "sha256:578acb3f2f9319f5df8c26430391cc84dd85ca2e4d76a044e4ec2082acad1e20",
  "ownerAuthorization": {
    "approvedBy": "Eng. Mostafa",
    "approvedAt": "2026-08-29",
    "basis": "Explicit owner authorization in the active Codex task to audit RouteBudget, create rare Italian content, publish it, submit sitemaps and request indexing."
  },
  "automatedChecks": {
    "sourceCoverage": true,
    "productClaims": true,
    "italianIntent": true,
    "seoContracts": true,
    "accessibilityContracts": true
  },
  "notes": "Automated review verifies exact Italian demand wording, Article 83-bis scope, documented cash-cost arithmetic and boundaries between quote PDF, contract, invoice and collection. No legal notice, interest entitlement or independent legal review is claimed."
}
